id,page,x,y,caption
img_654,486,50.28,43.86,"Pathogenesis of three common forms of pneumoconiosis. A, Coal-workers’ pneumoconiosis. The macrophages phagocytose large amount of coal dust particles which are then passed into the interstitial tissue of the lung and aggregate around respiratory bronchiole and cause focal dust emphysema. B, Silicosis. The tiny silica particles are toxic to macrophages. The dead macrophages release fi brogenic factor and eventually result in silicotic nodule. C, Asbestosis. Asbestos fi bres initiate lot of interstitial fi brosis and also form asbestos bodies."
img_656,487,48.0,42.12,Histologic appearance of the lung in coal-workers’ pneumoconiosis. Coal macules composed of aggregates of dust- laden macrophages and collagens are seen surrounding respiratory bronchioles. The alveoli and respiratory bronchioles surrounding the coal macule are distended.
img_657,487,316.62,529.56,"Gross appearance of the lung in silicosis, diagram matic appearance."
img_658,488,49.02,42.24,Microscopic picture of the lung in silicosis. The silicotic nodule consists of hyaline centre surrounded by concentric layers of collagen which are further enclosed by fi broblasts and dust-laden macrophages. Polarising microscopy in photomicrograph on right shows bright fi bres of silica.
img_659,489,62.34,561.72,"Gross appearance of the lung in asbestosis, diagram matic appearance."
img_660,489,337.26,42.24,Microscopic appearance of asbestos body. An asbestos body is an asbestos fi bre coated with glycoprotein and haemosiderin giving it beaded or dumbbell-shaped appearance with bulbous ends.
img_667,495,316.98,547.08,The two main gross patterns of bronchogenic carcinoma.
img_668,497,88.67,41.93,"Squamous cell carcinoma lung, hilar type. Sectioned surface shows grey-white fl eshy tumour in the bronchus at its bifurcation and occluding the lumen partly (arrow). The tumour is seen extending directly into adjacent lung parenchyma and hilar nodes."
img_669,497,48.0,527.76,Squamous cell carcinoma of the lung. Islands of invading malignant squamous cells are seen. A few well-developed cell nests with keratinisation are evident.
img_670,498,48.0,42.96,"Oat cell carcinoma of the lung. The tumour cells are arranged in sheets, cords or aggregates and at places form pseudorosettes. The individual tumour cells are small, uniform, lymphocyte-like with scanty cytoplasm. Inbox shows cytoplasmic granules positive for chromogranin immunostain."
img_671,498,48.12,519.72,"Adenocarcinoma lung. A, Photomicrograph shows lepidic growth pattern of tumour cells along the alveoli. B, It shows alveolar walls lined by cuboidal to tall columnar mucin-secreting tumour cells having papillary growth pattern."
img_676,500,346.91,41.93,"Metastatic deposits in the lung. Large parts of the lung parenchyma are replaced by multiple, variable-sized, circumscribed nodular masses which are grey-white in colour. Some of these show areas of haemorrhage and necrosis."
img_677,500,48.0,42.0,Central carcinoid of the lung. The tumour shows a characteristic nested of cells separated by fi brovascular septa. These nests are composed of uniform cuboidal cells having granular cytoplasm.
img_679,502,331.98,42.24,"Malignant (diff use) mesothelioma, gross appearance. The tumour is seen to form a thick, white, fl eshy coat over the parietal and visceral surfaces."
img_686,503,47.4,42.12,"Malignant mesothelioma, showing biphasic pattern of growth."
img_688,505,312.0,42.0,Chalazion of the eyelid. There is presence of a lipogranuloma having central pool of fat and surrounded by mixed inflammatory cells and foreign body type multinucleated giant cells.
img_690,507,52.44,42.0,Ocular lesions in hypertension.
img_691,508,311.52,476.86,"Sebaceous carcinoma. The tumour cells are arranged as lobules with peripheral basaloid cells and pale cells in the centre. The cells have sebaceous differentiation appreciated by foamy, vacuolated cytoplasm."
img_692,509,52.08,42.0,Choroidal melanoma appearing as a pigmented mass pushing the retina forward over it.
img_693,509,312.0,42.0,Uveal melanoma. The tumour cells are epithelioid in appearance having prominent nucleoli and contain black finely granular melanin pigment in the cytoplasm.
img_694,509,322.2,536.44,"Retinoblastoma, showing white mass growing extensively within the posterior part of the eye."
img_696,510,48.57,42.0,Retinoblastoma. The tumour arising from the retina (arrow) shows undifferentiated retinal cells and the typical rosettes.
img_698,512,48.12,42.24,Cholesteatoma middle ear. There is chronic inflammatory granulation tissue and foreign body giant cells around the cholesterol clefts and some pink keratinous material.
img_699,513,312.0,42.0,Allergic polyp nose. The overlying mucosa is covered partly by respiratory and partly by squamous metaplastic epithelium. The underlying stroma is oedematous and contains inflammatory cells with prominence of eosinophils.
img_700,513,48.0,527.42,Rhinosporidiosis in a nasal polyp. The spores are present in sporangia as well as are intermingled in the inflammatory cell infiltrate.
img_702,514,312.33,42.0,Inverted nasal papilloma. There is inverted pattern of growth of differentiated squamous cells with normal base to surface orientation.
img_703,515,312.0,486.69,"Angiofibroma nose. There is admixture of thin-walled blood vessels and spindled stroma. The blood vessels are variable-sized, some having incomplete muscle coat and there is absence of elastic tissue. The stroma has stellate fibroblasts and mast cells."
img_704,516,75.72,42.0,"Nasopharyngeal carcinoma, non-keratinising. The tumour is composed of undifferentiated anaplastic cells arranged in nests."
img_707,517,75.72,42.0,Squamous cell papilloma. There is papillomatosis; papillae are covered with well oriented and orderly layers of squamous cells.
img_708,517,315.72,42.0,Laryngeal nodule. The intact surface epithelium. The subepithelium has fibromyxoid appearance and contains proliferating blood vessels some of which are hyalinised.
img_709,518,336.72,42.0,Lymphoepithelial (branchial) cyst. The cyst is lined by stratified squamous epithelium and its wall contains lymphoid aggregates or follicles with germinal centres.
img_713,522,73.05,42.0,Fibrous epulis in the gingiva.
img_714,522,312.0,42.0,Mucous retention cyst (mucocele). There is inflamma tory reaction around extravasated mucus.
img_715,524,48.12,42.0,"Leukoplakia oral mucosa. A, Hyperkeratosis type. There is keratosis and orderly arrangement of increased number of layers of stratified mucosa. B, Dysplastic type. The number of layers is increased and the individual cells in layers show features of cytologic atypia and mitosis but there is no invasion across the basement membrane."
img_716,524,48.0,545.51,Frequency of occurrence of squamous cell carcinomas in the oral cavity.
img_718,525,53.68,42.0,"Squamous cell (Epidermoid) carcinoma of oral cavity, patterns of gross appearance."
img_719,525,48.61,507.65,"Oral mucosa showing epithelial dysplasia progressing to invasive squamous cell carcinoma. There is keratosis, irregular stratification, cellular pleomorphism, increased and abnormal mitotic figures and individual cell keratinisation, while a few areas show superficial invasive islands of malignant cells in the subepithelial soft tissues."
img_721,528,322.08,531.6,Dentigerous (Follicular) cyst. The cyst is composed of thin fibrous tissue wall and is lined by stratified squamous epithelium. A partly formed unerupted tooth is also seen in the wall. Inflammatory changes are conspicuously absent.
img_723,529,48.0,493.54,"Ameloblastoma, follicular and plexiform patterns. Epithelial follicles are composed of central area of stellate cells and peripheral layer of cuboidal or columnar cells. Plexiform areas show irregular plexiform masses and network of strands of epithelial cells. A few areas show central cystic change."
img_724,531,329.88,495.49,Lesions in mumps.
img_727,533,48.0,511.2,"Pleomorphic adenoma. The epithelial element is comprised of ducts, acini, tubules, sheets and strands of cuboidal and myoepithelial cells. These are seen randomly admixed with mesenchymal elements composed of pseudocartilage which is the matrix of myxoid, chondroid and mucoid material."
img_728,534,48.34,42.38,"Warthin’s tumour, showing eosinophilic epithelium forming glandular and papillary, cystic pattern with intervening stroma of lymphoid tissue."
img_729,535,47.52,42.46,"Mucoepidermoid carcinoma. The tumour shows combi- nation of mucinous, squamous and intermediate cells and having infiltrative border."
img_730,535,312.0,42.38,Adenoid cystic carcinoma. It shows nests of tumour cells having fenestrations containing basophilic material.
img_734,538,55.8,561.6,Patterns of hiatus hernia.
img_735,538,334.38,41.88,Oesophageal webs and rings.
img_736,539,311.7,473.88,Barrett’s oesophagus. The central part of the image shows squamous mucosa bounded on either side by metaplastic columnar mucosa showing anaplastic change and micropapillary pattern of adenocarcinoma. Inbox shows goblet cells in the metaplastic columnar epithelium strained positive for alcian blue.
img_738,541,54.66,42.0,"Squamous cell carcinoma oesophagus. A, Gross appearance. The tubular structure has thick muscle in its wall and has longitudinal mucosal folds. There is a concentric circumferential thickening in the middle (arrow) causing narrowing of the lumen (arrow). The mucosal surface is ulcerated. B, Photomicrograph shows whorls of anaplastic squamous cells invading the underlying soft tissues."
img_739,542,53.64,482.76,"Anatomical subdivisions of the stomach correlated with histological appearance of gastric mucosa in diff erent regions. D1, D2, D3 and D4 are the fi rst to fourth parts of the duodenum."
img_747,545,324.54,41.52,"Pyloric stenosis, infantile type. Longitudinal and transverse section of the stomach showing hypertrophy of the circular layer of the muscularis in the pyloric sphincter."
img_748,547,47.22,511.56,"Histologic appearance of H. pylori chronic gastritis. A, Diagrammatic representation. B, H&E stained section. C, Demonstration of H. pylori in Giemsa stain."
img_749,548,51.12,41.04,Consequences of long-term H. pylori gastritis.
img_750,548,49.98,540.12,"A, Chronic atrophic gastritis (right) contrasted with normal pyloric mucosa (left). There is marked gastric atrophy with disappearance of gastric glands and appearance of goblet cells (intestinal metaplasia). B, Photomicrograph showing chronic atrophic gastritis with intestinal metaplasia."
img_754,551,312.23,42.41,"Benign chronic peptic ulcer. Partial gastrectomy specimen showing a punched out round to oval ulcer on the mucosa, about 1 cm in diameter (arrow) and penetrating into muscularis layer."
img_755,551,51.0,552.48,Distribution of peptic ulcers.
img_756,552,69.3,497.28,"Chronic peptic ulcer. Histologic zones of the ulcer are illustrated in the diagram. The photomicrograph on right shows necrotic debris, ulceration and infl ammation on the mucosal surface."
img_761,554,337.02,523.68,Distribution of gastric carcinoma in the anatomical subdivisions of the stomach. The serial numbers in the fi gure indicate the order of frequency of occurrence of gastric cancer.
img_762,555,54.54,41.88,"Classifi cations of gastric carcinomas. A, Conventional classifi cation, showing correlation of the macroscopic subtypes with the main histological patterns. B, Classifi cation based on the depth of invasion by the tumour."
img_764,556,53.4,42.84,"Gastric carcinoma, gross appearance of subtypes and their corresponding dominant histological patterns."
img_765,557,53.4,42.84,"contd... Gastric carcinoma, gross appearance of subtypes and their corresponding dominant histological patterns."
img_766,558,48.36,42.24,"A, Ulcerative carcinoma stomach. The luminal surface of the stomach in the region of pyloric canal shows an elevated irregular growth with ulcerated surface and raised margins. B, Malignant cells forming irregular glands with stratifi cation are seen invading the layers of the stomach wall. C, Linitis plastica. The wall of the stomach in the region of pyloric canal is markedly thickened and fi brotic while the mucosal folds are lost. D, Microscopy shows characteristic signet ring tumour cells having abundant mucinous cytoplasm positive for mucicarmine (inbox). The stroma is desmoplastic."
img_771,561,48.84,42.0,"Meckel’s diverticulum. A, Common location and gross appearance. B, Resected segment of the small intestine shows an outpouching which on section is seen communicating with the intestinal lumen. The lumen contains necrotic debris."
img_775,562,336.3,41.52,Ileocaecal intussusception.
img_777,563,106.67,495.17,"Haemorrhagic infarct of the small intestine. The infarcted area is swollen, dark in colour and coated with fi brinous exudate. A sharp line of demarcation separates infarcted area from the normal bowel (arrow)."
img_778,563,310.91,499.42,"Infarct small intestine, microscopic appearance. The mucosa in the infarcted area shows coagulative necrosis and submucosal haemorrhages: muscularis is also partly aff ected. Infl ammatory cell infi ltration is marked at the line of demarcation between the infarcted and normal bowel."
img_783,566,49.09,44.68,"Crohn’s disease of the ileum. The histological features present are: transmural chronic infl ammatory cell infi ltration, deep fi ssures into the bowel wall, submucosal widening due to oedema, some prominent lymphoid follicles and a few non-caseating epithelioid cell granulomas in the bowel wall."
img_787,567,68.07,489.6,"Ulcerative colitis in active phase. The microscopic features seen are superfi cial ulcerations, with mucosal infi ltration by infl ammatory cells and a ‘crypt abscess’."
img_789,569,51.72,551.28,"Intestinal tuberculosis, three patterns."
img_790,570,53.87,42.17,"Intestinal tuberculosis. A, The external surface of small intestine shows stricture and a lymph node in section having caseation necrosis (arrow). B, The lumen shows characteristic transverse ulcers and two strictures (arrow). The wall of intestine in the area of narrowed lumen is thickened. C, Microscopy of intestine shows caseating epithelioid cell granulomas in the intestinal wall."
img_791,571,50.99,33.65,"A, Typhoid ulcers in the small intestine appear characteristically oval with their long axis parallel to the long axis of the bowel. B, Blood picture in typhoid fever showing neutropenia and relative lymphocytosis."
img_797,574,56.94,42.96,Jejunal biopsy diagrammatic appearance in malabsorption syndrome.
img_798,574,315.35,515.93,"A, Partial villus atrophy. There is shortening and blunting of the villi with reduction in their height. There is crypt hyperplasia. B, Subtotal villous atrophy. There is near total fl attening of the villi and crypt hyperplasia."
img_802,576,56.52,42.0,Carcinoid tumour. Gross appearance at common locations in longitudinal section.
img_803,576,47.35,529.02,"Microscopic appearance showing solid masses and trabeculae of uniform, monotonous, small cells with palisading of the peripheral cells."
img_805,577,99.35,41.93,Lymphoma small intestine. The polypoid growth is seen projecting into lumen while the covering mucosa is ulcerated.
img_806,577,331.62,548.88,Acute appendicitis. Gross appearance of longitudinally opened appendix showing impacted faecolith in the lumen and exudate on the serosa.
img_809,578,51.06,41.28,Acute appendicitis. Microscopic appearance showing diagnostic neutrophilic infi ltration into the muscularis. Other changes present are necrosis of mucosa and periappendicitis.
img_813,579,311.89,531.96,"Hirschsprung’s disease, diagrammatic representation of the pathologic changes."
img_814,580,312.23,544.85,Diverticulosis coli. The outpouchings on the mesentery communicate with lumen of colon.
img_815,581,47.99,518.09,External piles. There are thrombosed veins underneath the squamocolumar anorectal mucosa.
img_816,581,311.87,518.33,Fistula-in-ano. The fi stuous tract is lined by non-specifi c infl ammatory granulation tissue.
img_820,583,50.52,41.88,Hamartomatous polyps: Peutz-Jeghers polyp.
img_821,583,52.57,538.56,Juvenile polyp.
img_822,584,47.3,41.7,Adenomas (neoplastic polyps)—three main varieties.
img_823,585,336.47,420.41,Familial polyposis coli. The mucosal surface is straddled with multiple polyoid structures (arrow) of varying sizes many of which are pedunculated.
img_825,587,315.42,529.44,Distribution of the primary colorectal cancer.
img_826,588,60.22,35.85,"Gross appearance of colorectal carcinoma. A, Right-sided growth—fungating polypoid carcinoma showing caulifl ower-like growth projecting into the lumen. B, Left-sided growth—napkin-ring confi guration with spread of growth into the bowel wall."
img_827,589,50.28,42.36,"Colonic adenocarcinoma. A, Moderately diff erentiated. B, Mucin-secreting adenocarcinoma."
img_828,590,57.59,408.29,Anorectal carcinoma. The anorectal margin shows an ulcerated mucosa with thickened wall (arrow). The sectioned surface of rectal wall is grey-white and fl eshy due to infi ltration by the tumour.
img_832,590,54.78,35.52,Pathologic staging according to Astler-Coller system. (Also see facing Table 18.12).
img_839,593,55.08,502.44,"Anatomy of the liver and its relationship to the gallbladder, pancreas and duodenum."
img_840,594,51.78,42.0,Histology of hepatic lobule. The hexagonal or pyramidal structure with central vein and peripheral 4 to 5 portal triads is termed the classical lobule. The fi gure on left shows functional divisions of the lobule into 3 zones shown by circles. The fi gure on right shows hepatic sinusoid perisinusoidal space and cords of hepatocytes.
img_845,600,50.22,574.68,"Salient features in morphology of liver in intra- and extrahepatic cholestasis. A, Intrahepatic cholestasis is characterised by elongated bile plugs in the canaliculi of hepatocytes at the periphery of the lobule. B, Extrahepatic cholestasis shows characteristic bile lakes due to rupture of canaliculi in the hepatocytes in the centrilobular area."
img_854,604,51.48,464.76,Complications of hepatic failure.
img_862,608,51.96,41.88,Genomic structure of hepatitis B virus (Dane particle).
img_864,609,59.88,42.36,Consequences of coinfection versus superinfection in combined HDV-HBV infection.
img_867,612,48.12,42.12,"Acute viral hepatitis. The predominant histologic changes are: variable degree of necrosis of hepatocytes, most marked in zone 3 (centrilobular); and mononuclear cellular infi ltrate in the lobule. Mild degree of liver cell necrosis is seen as ballooning degeneration while acidophilic Councilman bodies (inbox) are indicative of more severe liver cell injury."
img_869,614,48.0,517.08,"Fulminant hepatitis. There is wiping out of liver lobules with only collapsed reticulin framework left out in their place, highlighted by reticulin stain (right photomicrograph). There is no signifi cant infl ammation or fi brosis."
img_874,615,45.56,40.45,Clinicopathologic course of HBV and HCV infection.
img_875,616,326.22,41.88,Gross appearance of pyogenic abscesses in the liver.
img_876,616,326.22,550.92,Amoebic liver abscess is commonly solitary and its wall is irregular and necrotic.
img_880,617,48.0,41.88,Miliary tuberculosis liver. The hepatic parenchyma shows epithelioid granulomas with small areas of central necrosis and surrounded peripherally by Langhans’ giant cells and lymphocytes.
img_882,618,47.82,533.04,Microscopy shows three layers in the wall of hydatid cyst. Inbox in the right photomicrograph shows a scolex with a row of hooklets.
img_885,621,54.78,44.82,Metabolism of ethanol in the liver. Thickness and intensity of colour of arrows on left side of fi gure corresponds to extent of metabolic pathway followed (ADH = alcohol dehydrogenase; ALDH or ACDH = hepatic acetaldehyde dehydrogenase; NAD = nicotinamide adenine dinucleotide; NADH = reduced NAD).
img_886,622,47.45,41.88,Pathogenesis of alcoholic liver disease.
img_887,623,48.0,41.88,Fatty liver (alcoholic steatosis). Most of the hepatocytes are distended with large lipid vacuoles with peripherally displaced nuclei.
img_888,623,47.58,520.2,Alcoholic hepatitis. Liver cells show ballooning degeneration and necrosis with some containing Mallory’s hyalin (Inbox). Fatty change and clusters of neutrophils are also present.
img_890,624,48.12,518.28,"Alcoholic cirrhosis, microscopic appearance. It shows nearly uniform-sized micronodules, devoid of central veins and having thick fi brous septa dividing them. There is minimal infl ammation and some reactive bile duct proliferation in the septa."
img_892,626,48.0,512.52,Post-necrotic cirrhosis. Fibrous septa dividing the hepatic parenchyma into nodules are thick and contain prominent mononuclear infl ammatory cell infi ltrate and bile ductular hyperplasia. A few intact hepatic lobules remain.
img_893,627,311.58,41.88,"Primary biliary cirrhosis, diagrammatic representation. There are fi brous scars dividing the hepatic parenchyma into the micronodules. The fi brous septa contain prominent lymphoid infi ltrate and proliferated bile ducts. Many of the hepatocytes contain elongated bile plugs."
img_898,632,315.42,42.0,Major clinical consequences of portal hypertension.
img_903,635,48.72,41.88,Cavernous haemangioma of the liver.
img_904,636,65.51,418.25,"Hepatocellular carcinoma. Sectioned surface shows a single, large mass (arrow) with irregular borders and having central areas of necrosis, while rest of the hepatic parenchyma in the upper part of the picture shows many nodules of variable sizes owing to co-existent macronodular cirrhosis."
img_905,636,61.02,42.0,Macroscopic patterns of hepatocellular carcinoma.
img_906,637,48.12,41.88,"Hepatocellular carcinoma, typical microscopic pattern. The tumour cells resembling hepatocytes show pleomorphism and are seen forming 2-8 cell wide trabeculae which are separated by endothelium-lined sinusoidal spaces."
img_907,637,47.7,508.68,Fibrolamellar carcinoma liver.
img_908,638,336.66,458.88,Metastatic deposits from adenocarcinoma in the liver.
img_911,638,55.68,42.0,"Metastatic tumour deposits in the liver as seen on sectioned surface. Characteristic features include multiple, variable-sized, nodular masses, often under the capsule, producing umbilication on the surface."
img_918,643,45.6,39.02,Pure gallstones of various types.
img_919,643,309.59,39.87,Mixed and combined gallstones.
img_920,643,47.88,482.52,Cholesterolosis of the gallbladder. The lamina propria of the mucosa shows foamy macrophages.
img_921,643,312.06,528.84,Major clinical eff ects and complications of gallstones.
img_925,644,68.58,476.28,"Chronic cholecystitis, microscopic appearance. There is penetration of epithelium-lined spaces into the gallbladder wall (Rokitansky- Aschoff sinus) in an area. There is subepithelial and sub serosal fi brosis and hypertrophy of muscularis. Mononuclear infl ammatory cell infi ltrate is present in subepithelial and perimuscular layers."
img_926,645,343.43,459.29,"Carcinoma gallbladder. The lumen of the gallbladder contains irregular, friable papillary growth arising from mucosa (arrow). Two multi-faceted gallstones (mixed) are also present in the lumen."
img_927,645,310.92,42.0,Frequency of cancer in the biliary system.
img_932,648,311.94,457.08,Chronic pancreatitis. There is destruction of acinar tissue and presence of dystrophic calcifi cation. The necrotic tissue is surrounded by mixed infl ammatory infi ltrate with granulation tissue formation.
img_935,649,51.12,42.0,Complications of chronic pancreatitis.
img_940,650,52.32,41.88,Distribution of carcinoma of the pancreas (numbered serially) and its major eff ects.
img_943,652,50.76,539.04,Cross-section of the kidney showing gross structures.
img_944,652,313.74,537.12,Cross-section of the kidney showing arterial blood supply.
img_946,654,47.68,542.28,Ultrastructure of glomerular fi ltration barrier.
img_947,654,54.32,44.59,Structure of a nephron.
img_954,658,330.06,447.0,Clinical manifestations in chronic kidney disease.
img_958,660,311.66,41.88,Cystic diseases of kidney.
img_959,660,311.94,492.9,Renal cystic dysplasia. There are cysts lined by fl attened epithelium while the intervening parenchyma consists of primitive connective tissue and cartilage.
img_960,661,48.12,532.68,Polycystic kidney disease. Diagrammatic representation of comparison of gross appearance of the two main forms.
img_961,661,311.94,42.24,Adult (autosomal dominant) polycystic kidney disease (ADPKD). The kidney is enlarged and heavy. Sectioned surface shows loss of demarcation between cortex and medulla and replacement of the entire renal parenchyma by cysts varying in diameter from a few millimeters to 4-5 cm. These cysts are not communicating with the pelvi- calyceal system. The renal pelvis and calyces are distorted due to cystic change.
img_974,669,352.07,42.17,Flea-bitten kidney. The kidney is enlarged in size and weight. The cortex shows tiny petechial haemorrhages visible through the capsule (arrow).
img_975,669,48.0,532.8,"Acute post-streptococcal GN, light microscopic appearance. There is increased cellularity due to proliferation of mesangial cells, endothelial cells and some epithelial cells and infi ltration of the tuft by neutrophils and monocytes."
img_976,670,48.0,41.88,"Acute glomerulonephritis, diagrammatic represen tation of ultrastructure of a portion of glomerular lobule showing characteristic electron-dense irregular deposits or ‘humps’ on the epithelial side of the GBM."
img_977,671,47.58,520.2,"RPGN (post-infectious type), light microscopic appearance. There are crescents in Bowman’s space forming adhesions between the glomerular tuft and Bowman’s capsule. The tuft shows hypercellularity and leucocytic infi ltration."
img_978,672,48.0,41.88,"RPGN, diagrammatic representation of ultrastructure of a portion of glomerular lobule showing epithelial crescent formation and subepithelial granular deposits."
