id,page,x,y,caption
img_360,233,48.0,42.0,"Replication and integration of DNA virus in the host cell. A, Replication: Step 1. The DNA virus invades the host cell. Step 2. Viral DNA is incorporated into the host nucleus and T-antigen is expressed immediately after infection. Step 3. Replication of viral DNA occurs and other components of virion are formed. The new virions are assembled in the cell nucleus. Step 4. The new virions are released, accompanied by host cell lysis. B, Integration : Steps 1 and 2 are similar as in replication. Step 3. Integration of viral genome into the host cell genome occurs which requires essential presence of functional T-antigen. Step 4. A ‘transformed (neoplastic) cell’ is formed."
img_361,233,322.92,42.0,Integration and replication of RNA virus (retrovirus) in the host cell. Step 1. The RNA virus invades the host cell. The viral envelope fuses with the plasma membrane of the host cell; viral RNA genome as well as reverse transcriptase are released into the cytosol. Step 2. Reverse transcriptase acts as template to synthesise single strand of matching viral DNA which is then copied to form complementary DNA resulting in double-stranded viral DNA (provirus). Step 3. The provirus is integrated into the host cell genome producing ‘transformed host cell.’ Step 4. Integration of the provirus brings about replication of viral components which are then assembled and released by budding.
img_363,238,51.48,42.0,Viruses (in brackets) in human tumours.
img_366,244,48.0,42.6,"Examples of IHC staining at different sites in the tumour cells. A, Membranous staining for leucocyte common antigen (LCA) or CD45 in lymphomas. B, Cytoplasmic staining for smooth muscle actin (SMA) in myoepithelium on breast acinus. C, Nuclear staining for breast ER-PR receptor studies in breast cancer."
img_369,248,333.74,573.31,"Consumption of tobacco in India as estimated by weight (Source: National Council of Applied Economic Research, New Delhi)."
img_371,249,51.24,424.95,"Major adverse effects of tobacco smoking. Right side shows smoking-related neoplastic diseases while left side indicates non- neoplastic diseases associated with smoking, numbered serially in order of frequency of occurrence."
img_372,251,53.88,42.0,Metabolism of ethanol in the liver. Thickness and intensity of colour of arrow on left side of figure corresponds to extent of metabolic pathway followed (MEOS = microsomal ethanol oxidizing system; ADH = alcohol dehydrogenase; ALDH = aldehyde dehydrogenase; NAD = nicotinamide adenine dinucleotide; NADH = reduced NAD; NADP = nicotinamide adenine dinucleotide phosphate; NADPH = reduced NADP).
img_373,251,327.36,457.75,Complications of chronic alcoholism.
img_374,252,318.48,42.0,Complications of lead poisoning.
img_377,255,315.12,42.0,Major sequelae of obesity.
img_378,256,315.12,42.0,Two forms of PEM.
img_380,259,330.12,512.4,Normal metabolism of vitamin D.
img_381,259,68.28,42.0,Lesions resulting from vitamin A deficiency.
img_382,260,337.08,42.0,Lesions in rickets.
img_383,262,347.04,481.2,Lesions in scurvy.
img_384,263,334.92,42.0,"Wet (Cardiac) beriberi. Flabby, thin-walled, enlarged and globular appearance of the heart due to four-chamber dilatation."
img_389,268,312.0,42.27,"Nuclear sexing. A, Sex chromatin as seen in scraped squamous cells from oral cavity. B, Barr body seen as drumstick appendage attached to a lobe of a circulating neutrophil."
img_390,268,312.0,578.91,Classification of chromosomes based on size and location of centromere.
img_391,269,48.0,470.07,Clinical features of important forms of numerical chromosomal abnormalities.
img_393,270,48.0,42.56,Common structural abnormalities of human chromosomes.
img_399,278,77.04,42.0,Sites of haematopoiesis in the bone marrow in the adult.
img_400,278,47.52,496.8,A normal bone marrow in an adult as seen in a section after trephine biopsy. Bony trabeculae support the marrow-containing tissue. Approximately 50% of the soft tissue of the bone consists of haematopoietic tissue and 50% is fatty marrow.
img_404,281,53.4,42.0,The erythroid series. There is progressive condensation of the nuclear chromatin which is eventually extruded from the cell at the late erythroblast stage. The cytoplasm contains progressively less RNA and more haemoglobin.
img_405,281,311.52,516.86,"Reticulocytes in blood as seen in blood stained by supravital dye, new methylene blue."
img_407,283,57.6,42.0,"A, Normal adult haemoglobin molecule (HbA) consisting of a2 b2 globin chains, each with its own haem group in oxy and deoxy state. The haemoglobin tetramer can bind up to four molecules of oxygen in the iron containing sites of the haem molecules. As oxygen is bound, salt bridges are broken, and 2,3-BPG and CO2 are expelled. B, Hb-dissociation curve. On dissociation of oxygen from Hb molecule i.e. on release of oxygen to the tissues, salt bridges are formed again, and 2,3-BPG and CO2, are bound. The shift of the curve to higher oxygen delivery is affected by acidic pH, increased 2,3-BPG and HbA molecule while oxygen delivery is less with high pH, low 2,3-BPG and HbF."
img_408,283,315.72,313.86,Normal red cell destruction in the RE system.
img_410,286,53.88,42.24,Some of the common morphologic abnormalities of red cells (The serial numbers in the illustrations correspond to the order in which they are described in the text).
img_412,288,53.73,302.4,"Daily iron cycle. Iron on absorption from upper small intestine circulates in plasma bound to transferrin and is transported to the bone marrow for utilisation in haemoglobin synthesis. The mature red cells are released into circulation, which on completion of their lifespan of 120 days, die. They are then phagocytosed by RE cells and iron stored as ferritin and haemosiderin. Stored iron is mobilised in response to increased demand and used for haemoglobin synthesis, thus completing the cycle (M = males; F = females)."
img_413,289,49.8,407.18,"Contrasting pathways of absorption and transport of iron, vitamin B12 and folic acid."
img_414,291,47.98,506.9,Laboratory findings in iron deficiency anaemia.
img_415,292,48.0,501.91,"Iron deficiency anaemia. A, PBF showing microcytic hypochromic anaemia. There is moderate microcytosis and hypochromia. B, Examination of bone marrow aspirate showing micronormoblastic erythropoiesis."
img_416,293,47.76,587.1,"A siderocyte containing Pappenheimer bodies, a normal sideroblast and a ring sideroblast."
img_417,293,311.52,42.0,Sideroblastic anaemia. Bone marrow aspirate smear in Perls’ stain shows marked excess of reticular iron and a ringed sideroblast (arrow) showing Prusian blue granules in the cytoplasm.
img_418,295,312.24,42.0,Pathogenesis of anaemia of chronic disorders through suppression of erythropoiesis by cytokines.
img_420,297,47.88,42.24,Biochemical basis of megaloblastic anaemia (THF = tetrahydrofolate; DHF = dihydrofolate; PGA = pteroyl glutamic acid; dUMP = deoxy uridylate monophosphate; dTMP = deoxy thymidylate monophos phate).
img_421,299,47.88,484.0,"Megaloblastic anaemia. A, PBF showing prominent macrocytosis of red cells and hypersegmented neutrophils. B, Examination of bone marrow aspirate showing megaloblastic erythropoiesis."
img_422,299,48.0,42.24,General laboratory findings in megaloblastic anaemia.
img_425,306,312.09,42.24,"Malarial parasite, Plasmodium falciparum, in the peripheral blood showing numerous ring stages and a crescent of gametocyte. The background shows a normoblast."
img_427,308,48.0,44.1,Peripheral blood film findings in hereditary spherocytosis.
img_428,308,320.28,569.86,Osmotic fragility test in hereditary spherocytosis showing increased fragility.
img_429,309,91.2,42.24,"Abbreviated pathways of anaerobic glycolysis (Embden-Meyerhof ) and hexose monophosphate (HMP) shunt in the metabolism of erythrocyte. The two red cell enzyme defects, glucose-6 phosphate dehydrogenase (G6PD) and pyruvate kinase, are shown in bold."
img_430,310,315.96,42.0,The geographic distribution of major haemo globino- pathies and thalassaemias. Thalassaemia and HbD are the haemoglobin disorders common in India.
img_431,311,53.52,42.0,"Pathogenesis of sickle cell anaemia. A, Basic molecular defect. B, Mechanism of polymerisation and consequent sickling of red cells containing HbS. C, Mechanism of sickling on oxygenation-deoxygenation."
img_432,311,320.88,448.64,Major clinical manifestations of sickle cell disease.
img_433,312,48.0,42.0,"Sickle cell anaemia. PBF shows crescent shaped elongated red blood cells, a few target cells and a few erythroblasts."
img_434,313,313.2,454.28,Pathogenesis of b-thalassaemia major.
img_436,315,54.36,42.0,Major clinical features of b-thalassaemia major.
img_437,315,48.0,535.2,Peripheral blood film findings in b-thalassaemia major.
img_438,316,312.0,42.0,"Bone marrow trephine biopsy in aplastic anaemia contrasted against normal cellular marrow. A, normal marrow biopsy shows about 50% fatty spaces and about 50% is haematopoietic marrow which contains a heterogeneous mixture of myeloid, erythroid and lymphoid cells. B, In aplastic anaemia, the biopsy shows suppression of myeloid and erythroid cells and replacement of haematopoietic elements by fat. There are scanty foci of cellular components composed chiefly of lymphoid cells."
img_439,316,51.01,554.4,Osmotic fragility testing b-thalassaemia major showing decreased fragility.
img_445,321,61.32,518.9,Thrombopoiesis.
img_446,322,53.88,42.24,"Main events in primary haemostasis—platelet adhesion, release (activation) and aggregation."
img_447,322,323.16,41.76,Molecular mechanisms in platelet adhesion and release reaction (Gp = glycoprotein).
img_448,322,322.92,561.86,The haemostatic balance.
img_450,324,54.6,42.24,"Pathways of blood coagulation, fibrinolytic system and participation of platelets in activation of the cascade and their role in haemostatic plug formation."
img_456,332,48.0,43.2,The pathogenesis of disseminated intravascular coagulation.
img_463,338,55.34,42.0,"Normal lymph node. A, The anatomic structure and functional zones of a lymph node. B, Maturation of lymphoid cells in the follicle."
img_464,339,48.0,42.7,"Reactive lymphadenitis, follicular hyperplasia type."
img_465,339,312.0,42.7,"Reactive lymphadenitis, sinus histiocytosis type."
img_467,341,48.0,42.0,"Granulopoiesis and the cellular compartments of myeloid cells in the bone marrow, blood and tissues."
img_468,342,47.76,615.6,The formation of lymphoid series of cells.
img_469,343,48.0,42.0,Morphology of normal mature leucocytes in peripheral blood.
img_470,344,48.09,42.0,Common variations in neutrophil morphology.
img_471,346,108.84,417.3,"The role of EBV in the pathogenesis of infectious mononucleosis, nasopharyngeal carcinoma and Burkitt’s lymphoma."
img_472,347,312.1,42.0,Peripheral blood film showing atypical lymphocytes in infectious mononucleosis.
img_473,348,48.2,42.49,"Leukaemoid reaction. A, Peripheral blood film showing marked neutrophilic leucocytosis accompanied with late precursors of myeloid series. B, Neutrophil (or leucocyte) alkaline phosphatase (NAP or LAP) activity is higher as demonstrated by this cytochemical stain."
img_476,351,47.4,42.0,The Philadelphia (Ph) chromosome. There is reciprocal translocation of the part of the long arms of chromosome 22 to the long arms of chromosome 9 written as t(9;22).
img_477,352,47.74,42.0,Maturation stages of myeloid cells in relation to corresponding types of myeloid neoplasms.
img_478,354,48.0,42.0,PBF findings in chronic myeloid leukaemia (CML).
img_480,358,48.0,42.24,PBF findings in a case of acute myeloblastic leukaemia (AML).
img_485,366,48.0,42.0,Microscopic features of 4 forms of Hodgkin’s disease of lymph node. The inset on right side of each type shows the morphologic variant of RS cell seen more often in particular histologic type.
img_486,367,48.0,42.6,"RS cells showing positive immunostaining for CD15, a B-cell marker."
img_487,367,48.0,516.0,"Hodgkin’s disease. A, Nodular sclerosis type. There are bands of collagen forming nodules and characteristic lacunar RS cells (inbox in left figure). B, Mixed cellularity type. There is admixture of mature lymphocytes, plasma cells, neutrophils and eosinophils and classic RS cells in the centre of the field (inbox in right figure)."
img_489,369,48.42,535.75,"PBF findings in acute lymphoblastic leukaemia (ALL). The cells are large, with round to convoluted nuclei having high N/C ratio and no cytoplasmic granularity. A few degenerated cells (smear cells) are also seen."
img_491,371,47.97,521.8,PBF in chronic lymphocytic leukaemia (CLL). There is large excess of mature and small differentiated lymphocytes and some degenerated forms appearing as bare smudged nuclei.
img_493,374,48.0,42.6,Burkitt’s lymphoma. The tumour shows uniform cells having high mitotic rate. Scattered among the tumour cells are benign macro- phages surrounded by a clear space giving ‘starry sky’ appearance.
img_495,375,48.04,42.0,"Hairy cell leukaemia. A, Peripheral blood shows presence of a leukaemic cells with hairy cytoplasmic projections. B, Trephine biopsy shows replacement of marrow spaces with abnormal mononuclear cells."
img_496,376,311.76,42.0,Metastatic carcinomatous deposits in the matted mass of lymph nodes. There are areas of necrosis in the circumscribed nodular areas.
img_499,378,57.96,42.0,The major sites of lesions in multiple myeloma.
img_500,379,48.0,42.0,"Bone marrow aspirate in myeloma showing numerous plasma cells, many with abnormal features."
img_503,382,48.0,43.2,"Langerhans cell histiocytosis—eosinophilic granuloma. A, Bone biopsy shows presence of infiltrate by collections of histio- cytes having vesicular nuclei admixed with eosinophils. B, Immuno- histochemical stain with S-100 shows cytoplasmic and nuclear positivity."
img_506,384,91.44,42.0,CVC spleen (Congestive splenomegaly). Sectioned surface shows that the spleen is heavy and enlarged in size. The colour of sectioned surface is grey-tan.
img_511,386,312.0,532.01,The structure of a medium-sized muscular artery.
img_515,389,48.0,42.0,Mönckeberg’s arteriosclerosis (medial calcific sclerosis). There is calcification exclusively in the tunica media unassociated with any significant inflammation.
img_520,395,48.12,532.23,Histologic appearance of a fully-developed atheroma.
img_521,396,319.56,43.49,Major sites of atherosclerosis (serially numbered) in descending order of frequency.
img_524,397,48.0,41.4,Major forms of symptomatic atherosclerotic disease.
img_525,398,312.0,42.0,"Syphilitic aortitis. There is endarteritis and periarteritis of the vasa vasorum in the media and adventitia. There is perivascular infiltrate of plasma cells, lymphocytes and macrophages."
img_526,399,312.0,495.71,Leucocytoclastic vasculitis. The vessel wall shows fibrinoid necrosis surrounded by viable as well as fragmented neutrophils.
img_527,401,47.76,516.0,Buerger’s disease (Thromboangiitis obliterans). There is acute panarteritis. The lumen is occluded by a thrombus containing microabscesses.
img_529,402,60.24,654.0,Common shapes of aneurysms of various types.
img_530,403,52.68,42.0,Sites of major forms of aneurysms.
img_531,404,49.68,396.0,"A, Dissecting aneurysm, (Type 1) beginning in the aortic arch and extending distally into the descending thoracic aorta as well as proximally into the ascending aorta. An intimal tear is seen in the arch. B, The cross section shows dissection typically separating the intima and inner two-thirds of the media on luminal side, from the outer one-third of the media and the adventitia. C, The ascending aorta is seen with the heart. There is an intimal tear in the aortic wall (black arrow) extending proximally upto aortic valve dissecting the media which contains clotted blood (white arrow)"
img_533,405,51.72,42.0,"Two classification schemes of thoracic aortic dissection: Stanford and DeBakey. Stanford type A involving ascending aorta only includes DeBakey’s type I (involving ascending aorta and extending into descending aorta as well) and II (limited to ascending aorta only), while Stanford type B is limited to descending aorta corresponds to DeBakey type III."
img_536,408,48.24,512.4,"Cavernous haemangioma of the liver. The vascular spaces are large, dilated, many containing blood, and are lined by flattened endothelial cells. Scanty connective tissue stroma is seen between the cavernous spaces."
img_537,408,48.84,42.0,Capillary haemangioma of the skin. There are capillaries lined by plump endothelial cells and containing blood. The intervening stroma consists of scant connective tissue.
img_538,409,48.0,524.72,Cavernous lymphangioma of the tongue. Large cystic spaces lined by the flattened endothelial cells and containing lymph are present. Stroma shows scattered collection of lymphocytes.
img_539,410,48.0,42.42,Glomus tumour. There are blood-filled vascular channels lined by endothelial cells and surrounded by nests and masses of glomus cells.
img_540,410,48.03,500.11,"Haemangioendothelioma nose. A, The vascular channels are lined by multiple layers of plump endothelial cells having minimal mitotic activity obliterating the lumina. B, Reticulin stain shows condensation of reticulin around the vessel wall but not between the proliferating cells."
img_541,410,311.76,500.11,"Haemangiopericytoma liver. Spindled cells surround the vascular lumina in a whorled fashion, highlighted by reticulin stain. These tumour cells have bland nuclei and few mitoses."
img_542,411,48.0,42.42,"Angiosarcoma spleen. A, Gross appearance of lobulated masses of grey white necrotic and haemorrhagic parenchyma. B, The tumour cells show proliferation of moderately pleomorphic anaplastic cells. C, These tumour cells show positive staining for endothelial marker, CD34."
img_545,412,48.0,42.92,Kaposi’s sarcoma in late nodular stage. There are slit-like blood-filled vascular spaces with extravasated RBCs. Between them are present bands of plump spindle-shaped tumour cells.
img_547,413,48.0,490.8,The normal structure of the heart.
img_549,414,53.64,495.82,Distribution of blood supply to the heart.
img_554,418,48.0,520.8,"A, Concentric cardiac hypertrophy. Weight of the heart is increased. The chambers opened up at the apex show concentric thickening of left ventricular wall (white arrow) with obliterated lumen (hypertrophy without dilatation). B, Eccentric cardiac hypertrophy. The heart is heavier. The free left ventricular wall is thickened (black arrow) while the lumen is dilated (white arrow) (hypertrophy with dilatation)."
img_555,419,47.76,42.0,Cardiac hypertrophy. Individual myocardial fibres are thick with prominent vesicular nuclei.
img_562,423,311.52,42.0,Left anterior descending (LAD) coronary artery showing critical narrowing with eccentric luminal obliteration due to complicated atheromatous plaque.
img_563,425,60.0,42.0,Spectrum of coronary ischaemic manifestations.
img_565,427,55.68,42.0,"Common locations and the regions of involvement in myocardial infarction. The figure shows region of myocardium affected by stenosis of three respective coronary trunks in descending order shown as: 1) left anterior descending coronary, 2) right coronary and 3) left circumflex coronary artery. A, As viewed from anterior surface. B, As viewed on transverse section at the apex of the heart."
img_566,428,48.0,540.82,"Myocardial infarction, healed. Opened up left heart shows grey white thinning of myocardium at the apex (arrow) due to healed fibrous scarring."
img_568,429,312.0,42.0,Old myocardial infarct. The infarcted area shows ingrowth of inflammatory granulation tissue.
img_569,430,55.68,595.97,Some common ECG changes in acute myocardial infarction.
img_570,431,68.76,42.0,Time course of serum cardiac markers for the diagnosis of acute MI.
img_572,432,47.27,42.24,"Chronic ischaemic heart disease. There is patchy myocardial fibrosis, especially around small blood vessels in the interstitium. The intervening single cells and groups of myocardial cells show myocytolysis."
img_578,434,97.2,550.8,"Pathogenesis of cor pulmonale (RVH= right ventricular hypertrophy, RHF= right heart failure)."
img_581,436,312.0,42.38,"An Aschoff body (granulomatous stage) in the myo- cardium. Inbox shows Anitschkow cell in longitudinal section (LS) with caterpillar-like serrated nuclear chromatin, while cross section (CS) shows owl-eye appearance of central chromatin mass and perinuclear halo."
img_584,438,54.24,42.38,"Rheumatic heart disease. A, Microscopic structure of the rheumatic valvulitis and a vegetation on the cusp of mitral valve in sagittal section. B, Section of the myocardium shows a healed Aschoff nodule in the interstitium having collagen, sparse cellularity, a multinucleate giant cell and Anitschkow cells. Inbox shows an Anitschkow cell in cross section (CS) and in longitudinal section (LS)."
img_590,443,54.12,502.4,"Infective endocarditis. A, Microscopic structure of a vegetation of BE on the surface of mitral valve in sagittal section. B, Section of the mitral valve shows fibrin cap on luminal surface, layer of bacteria, and deeper zone of inflammatory cells, with prominence of neutrophils."
img_592,444,52.78,453.48,Complications and sequelae of infective endocarditis.
img_597,449,47.88,42.0,Lymphocytic myocarditis showing focal inflammatory destruc tion of myocardial fibres and lymphocytic infiltrate in the interstitial tissue.
img_598,451,49.68,42.31,The major pathophysiologic forms of idiopathic cardiomyopathies.
img_600,454,312.0,42.0,"Fibrinopurulent pericarditis. The pericardium is covered with pink serofibrinous exudates. The space between the layers of the pericardium contains numerous inflammatory cells, chiefly PMNs."
img_607,458,71.16,436.08,"The structure of an acinus which is part of the lung distal to terminal bronchiole. It shows respiratory bronchiole, alveolar ducts and alveolar sacs."
img_608,459,51.12,42.0,"Histologic structure of alveolar wall (alveolar septa). It shows capillary endothelium, capillary basement membrane and scanty interstitial tissue and the alveolar lining cells (type I or membranous pneumocytes and type II or granular pneumocytes)."
img_614,461,48.12,535.8,"Histological appearance of hyaline membrane disease. There are alternate areas of collapsed and dilated alveolar spaces, many of which are lined by eosinophilic hyaline membranes."
img_622,464,57.18,42.24,Histologic changes in the pulmonary arterial branches of diff erent sizes in pulmonary hypertension.
img_623,466,53.22,42.24,"The four stages of lobar pneumonia, showing correlation of gross appearance of the lung with microscopic features in each stage. For details consult the text."
img_624,467,48.0,42.24,"Lobar pneumonia, acute congestion stage. There is congestion of septal walls while the air spaces contain pale oedema fl uid and a few red cells."
img_625,467,312.0,55.8,"Lobar pneumonia, red hepatisation stage. The alveoli are fi lled with cellular exudates composed of neutrophils admixed with some red cells."
img_626,467,48.0,503.16,"Lobar pneumonia, grey hepatisation stage. A, The sectioned surface of the lung shows grey-brown, fi rm area of consolidation (liver- like) aff ecting a lobe (arrow). B, The cellular exudate in the alveolar lumina is lying separated from the septal walls by a clear space. The infi ltrate in the lumina is composed of neutrophils and macrophages."
img_628,469,51.48,525.66,Microscopic appearance of bronchopneumonia. The bronchioles as well as the adjacent alveoli are fi lled with exudate consisting chiefl y of neutrophils. The alveolar septa are thickened due to congested capillaries and neutrophilic infi ltrate.
img_629,470,311.7,471.84,"Microscopic appearance of interstitial pneumonitis (viral pneumonia). There is necrotising bronchiolitis, reactive hyperplasia of alveolar epithelial cells, some having nuclear inclusions, and there is interstitial infl ammation."
img_630,471,312.06,42.0,Pneumocystis pneumonia. Smears from the sputum show frothy vacuolated exudate containing the organisms. Inbox shows Grocott's silver methenamine stain positivity for the organisms.
img_632,472,311.82,42.0,"Aspergillosis lung. A, Acute angled septate hyphae lying in necrotic debris and acute infl ammatory exudates in lung abscess. B, Organisms, Apergillus fl avus, are best identifi ed with a special stain for fungi, Gomory’s methenamine silver (GMS)."
img_635,473,56.16,525.72,"Common locations of lung abscess. A, Primary lung abscess—mostly single, large, commonly due to aspiration, located most frequently in the lower part of right upper lobe or apex of right lower lobe. B, Secondary lung abscesses—mostly multiple, small, most commonly post-pneumonic or following septic embolism."
img_639,474,47.78,42.1,"Lung abscess. A, The pleura is thickened. Cut surface of the lung shows multiple cavities 1-4 cm in diameter, having irregular and ragged inner walls (arrow). The lumina contain necrotic debris. The surrounding lung parenchyma is consolidated. B, The photomicrograph shows abscess formed by necrosed alveoli and dense acute and chronic infl ammatory cells."
img_641,476,320.22,450.39,Pathogenesis of alveolar wall destruction in emphysema by protease-antiprotease mechanism.
img_643,478,51.64,43.92,The anatomic regions of involvement in an acinus in major forms of emphysema.
img_644,479,48.0,42.0,Panacinar (Panlobular) emphysema showing involvement of the entire lobules and whole of acinus.
img_646,481,329.82,41.88,Types of bronchial dilatations in bronchiectasis.
img_649,482,53.16,42.0,Bronchiectasis of the lung. Sectioned surface shows honey-combed appearance of the lung in the lower lobe where many thick- walled dilated cavities with cartilaginous wall are seen (arrow).
img_650,482,53.61,527.82,Microscopic appearance of a dilated distal bronchiole in bronchiectasis. The bronchial wall is thickened and infi ltrated by acute and chronic infl ammatory cells. The mucosa is sloughed off at places with exudate of muco-pus in the lumen (arrow).
